bgg_id,bgg_name,year_published,play_time,rank,bayes_average,average,users_rated,average_weight,mechanisms,publishers,designers,families,categories
224517,"Brass: Birmingham",2018,120,1,8.40167,8.5771,52200,3.8684,"Chaining|End Game Bonuses|Hand Management|Income|Loans|Market|Multi-Use Cards|Network and Route Building|Ownership|Tags|Tech Trees / Tech Tracks|Tile Placement|Turn Order: Stat-Based|Variable Set-up","Roxley|Arclight Games|Board Game Rookie|BoardM Factory|CMON Global Limited|Conclave Editora|CrowD Games|Dexker Games|Funforge|Gém Klub Kft.|Ghenos Games|Giant Roc|Lanlalen|Lord of Boards|Maldito Games|PHALANX|Rebel Sp. z o.o.|TLAMA games|White Goblin Games|盒拍工作室 Hepa Studio","Gavan Brown|Matt Tolman|Martin Wallace","Cities: Birmingham (England)|Components: Map (Regional scale)|Components: Multi-Use Cards|Country: England|Crowdfunding: Kickstarter|Crowdfunding: Spieleschmiede|Digital Implementations: Steam|Digital Implementations: Tabletopia|Digital Implementations: VASSAL|Food & Drink: Beer|Game: Brass|History: Industrial Revolution|Misc: LongPack Games|Misc: Watch It Played How To Videos|Occupation: Engineer|Organizations: The Game Artisans of Canada|Theme: Canals","Age of Reason|Economic|Industry / Manufacturing|Post-Napoleonic|Trains|Transportation"
161936,"Pandemic Legacy: Season 1",2015,60,2,8.36231,8.51611,55623,2.8299,"Action Points|Cooperative Game|Hand Management|Legacy Game|Multi-Use Cards|Point to Point Movement|Scenario / Mission / Campaign Game|Set Collection|Tags|Trading|Variable Player Powers","Z-Man Games|Asterion Press|Devir|Filosofia Éditions|Gém Klub Kft.|Hobby Japan|Jolly Thinkers|Korea Boardgames|Lacerta|Lifestyle Boardgames Ltd|MINDOK|Ігромаг","Rob Daviau|Matt Leacock","Components: Map (Global Scale)|Components: Multi-Use Cards|Game: Pandemic|Mechanism: Campaign Games|Mechanism: Legacy|Medical: Diseases|Misc: Limited Replayability|Misc: Made by Panda|Occupation: Dispatcher|Occupation: Medic / Doctor / Nurses|Occupation: Researcher / Scientist|Region: The World|Theme: Science|Versions & Editions: Legacy Versions of Non-Legacy Games","Environmental|Medical"
342942,"Ark Nova",2021,150,3,8.34714,8.53653,52648,3.7812,"Action Queue|End Game Bonuses|Grid Coverage|Hand Management|Hexagon Grid|Income|Increase Value of Unchosen Resources|Open Drafting|Set Collection|Solo / Solitaire Game|Tags|Tile Placement|Variable Player Powers|Variable Set-up","Feuerland Spiele|Capstone Games|CMON Global Limited|Cranio Creations|Game Harbor|Gém Klub Kft.|Grok Games|IGAMES|Korea Boardgames|Lautapelit.fi|Ludofy Creative|Maldito Games|MINDOK|MIPL|Portal Games|Regatul Jocurilor|Super Meeple|テンデイズゲームズ (TendaysGames)|Tower Tactic Games|White Goblin Games","Mathias Wigge","Animals: Okapi|Components: Hexagonal Tiles|Digital Implementations: Board Game Arena|Digital Implementations: Steam|Digital Implementations: TableTop Simulator Mod (TTS)|Game: Ark Nova|Mechanism: Tableau Building|Players: Games with Solitaire Rules|Theme: Ecology|Theme: Science|Theme: Zoos, Aquaria, Safari Parks","Animals|Economic|Environmental"
174430,"Gloomhaven",2017,120,4,8.32388,8.5628,64923,3.9142,"Action Queue|Action Retrieval|Campaign / Battle Card Driven|Card Play Conflict Resolution|Communication Limits|Cooperative Game|Critical Hits and Failures|Deck Construction|Grid Movement|Hand Management|Hexagon Grid|Legacy Game|Line of Sight|Modular Board|Multi-Use Cards|Narrative Choice / Paragraph|Once-Per-Game Abilities|Role Playing|Scenario / Mission / Campaign Game|Simultaneous Action Selection|Solo / Solitaire Game|Storytelling|Tags|Variable Player Powers","Cephalofair Games|Albi|Albi Polska|Arclight Games|Feuerland Spiele|Galápagos Jogos|Games Warehouse|Gém Klub Kft.|Hobby World|Korea Boardgames|MYBG Co., Ltd.","Isaac Childres","Category: Dungeon Crawler|Components: Map (City Scale)|Components: Miniatures|Components: Multi-Use Cards|Components: Standees|Creatures: Demons|Creatures: Dragons|Creatures: Monsters|Crowdfunding: Kickstarter|Digital Implementations: Steam|Digital Implementations: TableTop Simulator Mod (TTS)|Game: Gloomhaven|Mechanism: Campaign Games|Mechanism: Legacy|Misc: Forteller Audio Narration|Misc: Made by Panda|Players: Games with Solitaire Rules","Adventure|Exploration|Fantasy|Fighting|Miniatures"
233078,"Twilight Imperium: Fourth Edition",2017,480,5,8.22746,8.57681,26128,4.3354,"Action Drafting|Area-Impulse|Dice Rolling|Follow|Grid Movement|Hexagon Grid|Increase Value of Unchosen Resources|King of the Hill|Modular Board|Movement Points|Race|Tech Trees / Tech Tracks|Trading|Variable Phase Order|Variable Player Powers|Variable Set-up|Voting","Fantasy Flight Games|ADC Blackfire Entertainment|Arclight Games|Asterion Press|Delta Vision Publishing|Edge Entertainment|Galakta|Galápagos Jogos|Geekach Games|Hobby World|Playfun Games|sternenschimmermeer","Dane Beltrami|Corey Konieczka|Christian T. Petersen","Components: Hexagonal Tiles|Components: Map (Interplanetary or Interstellar scale)|Components: Miniatures|Game: Twilight Imperium|Mechanism: 4X|Misc: Made by Panda","Civilization|Economic|Exploration|Negotiation|Political|Science Fiction|Space Exploration|Territory Building|Wargame"
316554,"Dune: Imperium",2020,120,6,8.22676,8.42067,52649,3.0644,"Card Play Conflict Resolution|Deck, Bag, and Pool Building|Delayed Purchase|Force Commitment|Increase Value of Unchosen Resources|Multi-Use Cards|Open Drafting|Race|Solo / Solitaire Game|Tags|Take That|Turn Order: Progressive|Variable Player Powers|Worker Placement","Dire Wolf|Arclight Games|Broadway Toys LTD|Galápagos Jogos|Geekach Games|Lavka Games|Lucky Duck Games|MIPL|Reflexshop|REXhry|sternenschimmermeer|Tabletop KZ|YingDi (旅法师营地)","Paul Dennen","Books: Dune|Components:  Meeples|Components: Multi-Use Cards|Digital Implementations: Google Play|Digital Implementations: Steam|Game: Dune: Imperium|Misc: LongPack Games|Misc: Watch It Played How To Videos|Players: Games with Solitaire Rules","Movies / TV / Radio theme|Novel-based|Political|Science Fiction"
167791,"Terraforming Mars",2016,120,7,8.19973,8.34853,106445,3.2663,"Closed Drafting|Contracts|End Game Bonuses|Hand Management|Hexagon Grid|Income|Set Collection|Solo / Solitaire Game|Tags|Take That|Tech Trees / Tech Tracks|Tile Placement|Turn Order: Progressive|Variable Player Powers|Variable Set-up|Victory Points as a Resource","FryxGames|Arclight Games|Brädspel.se|Fantasmagoria|Ghenos Games|Green Elephant Games|Intrafin Games|Kaissa Chess & Games|Kilogames|Korea Boardgames|Lautapelit.fi|Lavka Games|Lex Games|Maldito Games|MeepleBR|MINDOK|MIPL|MYBG Co., Ltd.|NeoTroy Games|Rebel Sp. z o.o.|Reflexshop|Schwerkraft-Verlag|Siam Board Games|Stronghold Games|SuperHeated Neurons|Surfin' Meeple China","Jacob Fryxelius","Category: Dized Tutorial|Components: Map (Global Scale)|Components: Multi-Use Cards|Digital Implementations: Board Game Arena|Digital Implementations: Google Play|Digital Implementations: Steam|Game: Terraforming Mars|Mechanism: Tableau Building|Occupation: Engineer|Players: Games with Solitaire Rules|Series: Terraforming Mars|Setting: Future Timeline (Fryxgames)|Space: Colonization / Extraterrestrial Colonisation|Space: Earth's Solar System|Space: Jupiter|Space: Mars|Theme: Science","Civilization|Economic|Environmental|Industry / Manufacturing|Science Fiction|Space Exploration|Territory Building"
115746,"War of the Ring: Second Edition",2011,180,8,8.19267,8.54869,23328,4.2233,"Action Drafting|Area Majority / Influence|Area Movement|Campaign / Battle Card Driven|Card Play Conflict Resolution|Dice Rolling|Events|Hand Management|Movement Points|Team-Based Game|Variable Player Powers|Variable Set-up","Ares Games|Angry Lion Games|Devir|GaGa Games|Galakta|Geekach Games|Heidelberger Spieleverlag|Nuts! Publishing|Planplay|Red Glove|REXhry|Schwerkraft-Verlag|Sophisticated Games|Zhiyanjia","Roberto Di Meglio|Marco Maggi|Francesco Nepitello","Authors: J.R.R. Tolkien|Category: Dized Tutorial|Components: Map (Continental / National scale)|Components: Miniatures|Creatures: Monsters|Series: War of the Ring (Nexus/Ares Games)|Theme: Medieval Fantasy","Fantasy|Fighting|Novel-based|Territory Building|Wargame"
187645,"Star Wars: Rebellion",2016,240,9,8.16878,8.41931,34538,3.7432,"Area Majority / Influence|Area Movement|Card Play Conflict Resolution|Contracts|Delayed Purchase|Dice Rolling|Die Icon Resolution|Events|Hand Management|Hidden Movement|Income|Once-Per-Game Abilities|Tags|Take That|Team-Based Game|Variable Player Powers|Variable Set-up|Worker Placement, Different Worker Types","Fantasy Flight Games|ADC Blackfire Entertainment|Asterion Press|Delta Vision Publishing|Edge Entertainment|Galakta|Galápagos Jogos|Geekach Games|Heidelberger Spieleverlag|Hobby World|Korea Boardgames","Corey Konieczka","Components: Map (Interplanetary or Interstellar scale)|Components: Miniatures|Components: Standees|Creatures: Aliens / Extraterrestrials|Movies: Star Wars","Civil War|Miniatures|Movies / TV / Radio theme|Science Fiction|Space Exploration|Wargame"
162886,"Spirit Island",2017,120,10,8.1416,8.34131,57607,4.0747,"Action Retrieval|Area Majority / Influence|Automatic Resource Growth|Campaign / Battle Card Driven|Cooperative Game|Deck, Bag, and Pool Building|Hand Management|Modular Board|Simultaneous Action Selection|Solo / Solitaire Game|Tags|Variable Player Powers|Variable Set-up","Greater Than Games, LLC|999 Games|Ace Studios|Arrakis Games|BoardM Factory|Engames|Fabled Nexus|Fox in the Box|Games7Days|Gém Klub Kft.|Ghenos Games|Hobby World|Intrafin Games|Lacerta|One Moment Games|Pegasus Spiele|Portal Games|REXhry|Siam Board Games","R. Eric Reuss","Category: Dized Tutorial|Components: Control Boards|Components: Map (Continental / National scale)|Components: Miniatures|Components: Official Music Soundtrack|Components: Wooden pieces & boards|Crowdfunding: Kickstarter|Digital Implementations: Apple App Store|Digital Implementations: Google Play|Digital Implementations: Steam|Game: Spirit Island|Islands: Fictional|Misc: LongPack Games|Players: Games with Solitaire Rules|Theme: Colonial|Theme: Tropical|Theme: Tropical Islands","Environmental|Fantasy|Fighting|Mythology|Territory Building"
291457,"Gloomhaven: Jaws of the Lion",2020,120,11,8.12574,8.39332,37902,3.6369,"Action Queue|Action Retrieval|Campaign / Battle Card Driven|Communication Limits|Cooperative Game|Critical Hits and Failures|Deck Construction|Grid Movement|Hand Management|Hexagon Grid|Legacy Game|Line of Sight|Multi-Use Cards|Once-Per-Game Abilities|Player Elimination|Role Playing|Scenario / Mission / Campaign Game|Simultaneous Action Selection|Solo / Solitaire Game|Variable Player Powers","Cephalofair Games|Albi|Albi Polska|Arclight Games|CoolPlay|Feuerland Spiele|Galápagos Jogos|Gém Klub Kft.|Hobby World|Korea Boardgames|Lord of Boards|Meanbook Games|Siam Board Games","Isaac Childres","Category: Dungeon Crawler|Components: Book as Board|Components: Miniatures|Components: Multi-Use Cards|Components: Standees|Digital Implementations: Steam|Digital Implementations: TableTop Simulator Mod (TTS)|Game: Gloomhaven|Mechanism: Campaign Games|Mechanism: Legacy|Misc: Forteller Audio Narration|Misc: Limited Replayability|Misc: Watch It Played How To Videos|Players: Games with Solitaire Rules","Adventure|Exploration|Fantasy|Fighting|Miniatures"
220308,"Gaia Project",2017,150,13,8.09683,8.36021,29403,4.3975,"End Game Bonuses|Hexagon Grid|Income|Modular Board|Network and Route Building|Solo / Solitaire Game|Tags|Tech Trees / Tech Tracks|Turn Order: Pass Order|Variable Player Powers|Variable Set-up|Victory Points as a Resource","Feuerland Spiele|Capstone Games|Cranio Creations|DiceTree Games|Edge Entertainment|Game Harbor|Games Factory|Hobby World|IGAMES|Maldito Games|Mandala Jogos|Portal Games|Reflexshop|Super Meeple|テンデイズゲームズ (TendaysGames)|TLAMA games|White Goblin Games|Z-Man Games","Jens Drögemüller|Helge Ostertag","Category: Combinatorial|Components: Control Boards|Components: Map (Interplanetary or Interstellar scale)|Digital Implementations: Board Game Arena|Digital Implementations: Google Play|Digital Implementations: Steam|Digital Implementations: TableTop Simulator Mod (TTS)|Mechanism: Tableau Building|Misc: Made by Panda|Organizations: Automa Factory|Players: Games with Solitaire Rules|Series: Terra Mystica","Civilization|Economic|Miniatures|Science Fiction|Space Exploration|Territory Building"
12333,"Twilight Struggle",2005,180,14,8.05297,8.2368,50519,3.6116,"Action / Event|Advantage Token|Area Majority / Influence|Campaign / Battle Card Driven|Dice Rolling|Events|Hand Management|Simulation|Simultaneous Action Selection|Sudden Death Ending|Tug of War|Variable Set-up","GMT Games|Asterion Press|Bard Centrum Gier|Chrononauts Games|Devir|DiceTree Games|GaGa Games|MINDOK|PHALANX|Pixie Games|Udo Grebe Gamedesign|Wargames Club Publishing","Ananda Gupta|Jason Matthews","Components: Map (Global Scale)|Components: Multi-Use Cards|Continents: Asia|Country: Soviet Union|Country: USA|Digital Implementations: Google Play|Digital Implementations: Steam|Game: Twilight Struggle|History: Cold War|Misc: BGG Hall of Fame|Misc: Dice Tower Hall of Fame|Players: Two-Player Only Games|Players: Wargames with Rules Supporting Only Two Players|Political: NATO|Region: The World|Series: Twilight Struggle|Theme: Nuclear option|War Level of Command: Grand Strategy","Modern Warfare|Political|Wargame"
182028,"Through the Ages: A New Story of Civilization",2015,120,15,8.0356,8.26738,33384,4.4423,"Action Points|Auction / Bidding|Auction: Dutch|Events|Income|Open Drafting|Player Elimination|Tags|Take That","Czech Games Edition|Cranio Creations|Devir|DiceTree Games|Eagle-Gryphon Games|Feelindigo|GaGa Games|Gém Klub Kft.|HaKubia|HeidelBÄR Games|Heidelberger Spieleverlag|IELLO|MINDOK|New Games Order, LLC|One Moment Games|Rebel Sp. z o.o.","Vlaada Chvátil","Digital Implementations: Board Game Arena|Digital Implementations: Google Play|Digital Implementations: Steam|Game: Through the Ages|Historical Figures: Various|Mechanism: Tableau Building|Misc: BGG Hall of Fame|Theme: Colonial","Card Game|Civilization|Economic"
84876,"The Castles of Burgundy",2011,90,16,8.02162,8.14984,65993,2.972,"Delayed Purchase|Dice Rolling|End Game Bonuses|Grid Coverage|Hexagon Grid|Open Drafting|Pattern Building|Tile Placement|Track Movement|Turn Order: Stat-Based|Variable Set-up","alea|Ravensburger|Broadway Toys LTD|Giochi Uniti|Grow Jogos e Brinquedos|Hobby World|Maldito Games|Rebel Sp. z o.o.","Stefan Feld","Animals: Cattle / Cows|Animals: Chickens / Roosters|Animals: Pigs|Animals: Sheep|Country: France|Digital Implementations: Board Game Arena|Digital Implementations: Boiteajeux|Digital Implementations: Google Play|Digital Implementations: Steam|Digital Implementations: Yucata|Game: The Castles of Burgundy|Mechanism: Tableau Building|Misc: BGG Hall of Fame|Misc: Dice Tower Hall of Fame|Misc: Watch It Played How To Videos|Players: Games with expansions that add solo play|Region: Burgundy (France)|Series: Alea Big Box","Animals|Dice|Medieval|Territory Building"
193738,"Great Western Trail",2016,150,17,7.9969,8.16758,42509,3.6982,"Deck, Bag, and Pool Building|Hand Management|Ownership|Set Collection|Track Movement|Variable Set-up","eggertspiele|999 Games|Arclight Games|Broadway Toys LTD|Conclave Editora|Delta Vision Publishing|Ediciones MasQueOca|Gigamic|Korea Boardgames|Lacerta|Ludicus|MINDOK|Pegasus Spiele|Plan B Games|Stronghold Games|uplay.it edizioni|YOKA Games|Zvezda","Alexander Pfister","Animals: Cattle / Cows|Cities: Kansas City (Missouri, USA)|Components: Control Boards|Components: Map (Regional scale)|Components: Wooden pieces & boards|Country: USA|Digital Implementations: Board Game Arena|Game: Great Western Trail|Mechanism: Tableau Building|Series: The Great Designers (Stronghold Games)|States: Texas","American West|Animals|Economic"
169786,"Scythe",2016,115,18,7.9677,8.11988,88807,3.4511,"Area Majority / Influence|Card Play Conflict Resolution|Contracts|End Game Bonuses|Force Commitment|Grid Movement|Hexagon Grid|King of the Hill|Movement Points|Narrative Choice / Paragraph|Solo / Solitaire Game|Take That|Tech Trees / Tech Tracks|Variable Player Powers|Variable Set-up|Victory Points as a Resource|Zone of Control","Stonemaier Games|Albi|Angry Lion Games|Arclight Games|CrowD Games|Delta Vision Publishing|Feuerland Spiele|Fire on Board Jogos|Galápagos Jogos|Geekach Games|Ghenos Games|Korea Boardgames|Ludofy Creative|Maldito Games|Matagot|Morning|PHALANX|Planeta Igor|Playfun Games|Surfin' Meeple China","Jamey Stegmaier","Category: Autonomous simulation|Category: Dized Tutorial|Components:  Meeples|Components: Control Boards|Components: Map (Continental / National scale)|Components: Miniatures|Components: Wooden pieces & boards|Continents: Europe|Crowdfunding: Kickstarter|Decades: The 1920's|Digital Implementations: Board Game Arena|Digital Implementations: Google Play|Digital Implementations: Steam|Digital Implementations: TableTop Simulator Mod (TTS)|Digital Implementations: Tabletopia|Game: Scythe|Mechanism: Tableau Building|Misc: Made by Panda|Misc: Watch It Played How To Videos|Organizations: Automa Factory|Players: Games with Solitaire Rules|Theme: Alternate History|Theme: Dieselpunk|Theme: Mech Warfare","Economic|Fighting|Science Fiction|Territory Building"
246900,"Eclipse: Second Dawn for the Galaxy",2020,200,19,7.96705,8.41558,15607,3.6432,"Alliances|Area Majority / Influence|Area-Impulse|Dice Rolling|Grid Movement|Hexagon Grid|Hot Potato|Income|Modular Board|Passed Action Token|Tech Trees / Tech Tracks|Variable Player Powers","Lautapelit.fi|Arclight Games|CrowD Games|Maldito Games|Matagot|MeepleBR|Pegasus Spiele|sternenschimmermeer|Surfin' Meeple China|TLAMA games|uplay.it edizioni","Touko Tahkokallio","Components: Control Boards|Components: Game Trayz Inside|Components: Map (Interplanetary or Interstellar scale)|Components: Miniatures|Crowdfunding: Kickstarter|Digital Implementations: Steam|Game: Eclipse (Lautapelit.fi)|Mechanism: 4X|Misc: Made by Panda","Civilization|Exploration|Science Fiction|Space Exploration|Territory Building|Wargame"
173346,"7 Wonders Duel",2015,30,20,7.96305,8.08689,102180,2.2244,"End Game Bonuses|Income|Melding and Splaying|Modular Board|Multi-Use Cards|Once-Per-Game Abilities|Open Drafting|Score-and-Reset Game|Set Collection|Sudden Death Ending|Tags|Tech Trees / Tech Tracks|Track Movement|Tug of War|Variable Set-up","Repos Production|ADC Blackfire Entertainment|Asmodee|Asterion Press|Boardgame Space|CoolPlay|Galápagos Jogos|Gém Klub Kft.|Hobby Japan|KADABRA|Kaissa Chess & Games|Korea Boardgames|Lautapelit.fi|Lifestyle Boardgames Ltd|Ludicus|Ponva d.o.o.|Pridemage Games|Rebel Sp. z o.o.|Siam Board Games|Sombreros Production|Ігромаг","Antoine Bauza|Bruno Cathala","Ancient: Babylon|Ancient: Egypt|Ancient: Greece|Ancient: Rome|Constructions: Pyramids|Digital Implementations: Board Game Arena|Digital Implementations: Google Play|Game: 7 Wonders|Game: 7 Wonders Duel|Mechanism: Tableau Building|Misc: Watch It Played How To Videos|Players: Games with expansions that add solo play|Players: Two-Player Only Games|Versions & Editions: Two-Player Versions of More-Player Games","Ancient|Card Game|City Building|Civilization|Economic"
28720,"Brass: Lancashire",2007,120,21,7.96112,8.19691,26144,3.8523,"Hand Management|Income|Loans|Market|Network and Route Building|Tech Trees / Tech Tracks|Turn Order: Stat-Based","Roxley|Warfrog Games|Arclight Games|BoardM Factory|Conclave Editora|CrowD Games|Dexker Games|Eagle-Gryphon Games|FRED Distribution, Inc.|Funforge|Ghenos Games|Giant Roc|Maldito Games|Pegasus Spiele|PHALANX|Rebel Sp. z o.o.|Wargames Club Publishing|White Goblin Games","Martin Wallace","Cities: Manchester (England, UK)|Components: Map (Continental / National scale)|Components: Map (Regional scale)|Country: England|Crowdfunding: Spieleschmiede|Digital Implementations: Apple App Store|Digital Implementations: Steam|Game: Brass|History: Industrial Revolution|Misc: BGG Hall of Fame|Misc: LongPack Games|Theme: Canals","Economic|Educational|Industry / Manufacturing|Post-Napoleonic|Transportation"
167355,"Nemesis",2018,180,23,7.94855,8.25539,34078,3.4818,"Campaign / Battle Card Driven|Cooperative Game|Dice Rolling|Hand Management|Hidden Roles|Interrupts|Modular Board|Player Elimination|Semi-Cooperative Game|Solo / Solitaire Game|Team-Based Game|Traitor Game|Variable Player Powers","Awaken Realms|Rebel Sp. z o.o.|Arclight Games|Asmodee|Cranio Creations|Delta Vision Publishing|Funforge|Galápagos Jogos|Geekach Games|Hobby World|Korea Boardgames|MINDOK|Rebel Studio","Adam Kwapiński","Category: Dungeon Crawler|Components: Dice with Icons|Components: Miniatures|Components: Polyhedral (not D6) dice|Creatures: Aliens / Extraterrestrials|Crowdfunding: Kickstarter|Crowdfunding: Modian|Game: Nemesis|Misc: Eastar Game Manufacturing|Players: Games with Solitaire Rules","Adventure|Horror|Miniatures|Science Fiction"
295770,"Frosthaven",2022,180,22,7.95003,8.78281,8676,4.4129,"Campaign / Battle Card Driven|Communication Limits|Cooperative Game|Deck Construction|Deck, Bag, and Pool Building|Grid Movement|Hand Management|Hexagon Grid|Legacy Game|Modular Board|Multi-Use Cards|Narrative Choice / Paragraph|Once-Per-Game Abilities|Scenario / Mission / Campaign Game|Simultaneous Action Selection|Solo / Solitaire Game|Variable Player Powers","Cephalofair Games|Albi|Albi Polska|CMON Global Limited|Delta Vision Publishing|Feuerland Spiele|Korea Boardgames","Isaac Childres","Category: Dungeon Crawler|Components: Miniatures|Components: Multi-Use Cards|Components: Standees|Crowdfunding: Kickstarter|Digital Implementations: TableTop Simulator Mod (TTS)|Game: Gloomhaven|Mechanism: Campaign Games|Mechanism: Legacy|Misc: Forteller Audio Narration|Players: Games with Solitaire Rules","Adventure|Exploration|Fantasy|Fighting|Miniatures"
266507,"Clank! Legacy: Acquisitions Incorporated",2019,120,24,7.94382,8.51301,10455,2.7389,"Deck, Bag, and Pool Building|Delayed Purchase|End Game Bonuses|Events|Legacy Game|Map Addition|Movement Points|Narrative Choice / Paragraph|Once-Per-Game Abilities|Open Drafting|Pick-up and Deliver|Player Elimination|Point to Point Movement|Push Your Luck|Scenario / Mission / Campaign Game|Set Collection|Variable Player Powers|Variable Set-up","Dire Wolf|Penny Arcade|Renegade Game Studios|Devir|Korea Boardgames|Lavka Games|Lucrum Games|Origames|Schwerkraft-Verlag","Andy Clautice|Paul Dennen","Category: Dungeon Crawler|Components: Miniatures|Creatures: Dragons|Creatures: Goblins|Game: Clank!|Mechanism: Campaign Games|Mechanism: Legacy|Versions & Editions: Legacy Versions of Non-Legacy Games","Adventure|Fantasy|Miniatures"
177736,"A Feast for Odin",2016,120,25,7.94162,8.16478,31053,3.8609,"Automatic Resource Growth|Dice Rolling|Grid Coverage|Income|Push Your Luck|Solo / Solitaire Game|Tile Placement|Turn Order: Pass Order|Worker Placement","Feuerland Spiele|Cranio Creations|Devir|Filosofia Éditions|Game Harbor|Hobby World|Korea Boardgames|Lacerta|Maldito Games|Mandala Jogos|Rebel Sp. z o.o.|Super Meeple|テンデイズゲームズ (TendaysGames)|TLAMA games|White Goblin Games|Z-Man Games","Uwe Rosenberg","Components: Polyhedral (not D6) dice|Components: Polyominoes|Components: Wooden pieces & boards|Country: Iceland|Country: Norway|Digital Implementations: Board Game Arena|Game: A Feast for Odin|Islands: Greenland (Denmark)|Mechanism: Tableau Building|Mythology: Norse|Players: Games with Solitaire Rules|Region: Arctic|Series: Harvest (Uwe Rosenberg)|Theme: Food / Cooking|Theme: Vikings","Economic|Farming|Industry / Manufacturing|Medieval|Puzzle"
124361,"Concordia",2013,100,26,7.93228,8.08409,42875,2.9864,"Action Retrieval|Advantage Token|Auction: Dutch|Deck, Bag, and Pool Building|End Game Bonuses|Hand Management|Hidden Victory Points|Investment|Movement Points|Network and Route Building|Open Drafting|Point to Point Movement|Set Collection|Variable Set-up","PD-Verlag|999 Games|Cranio Creations|CrowD Games|Ediciones MasQueOca|Egmont Polska|Gém Klub Kft.|Heidelberger Spieleverlag|Korea Boardgames|Laguna|Lex Games|New Games Order, LLC|Playfun Games|Rio Grande Games|Ystari Games","Mac Gerdts","Ancient: Rome|Components:  Meeples|Components: Map (Continental / National scale)|Digital Implementations: Apple App Store|Digital Implementations: Boiteajeux|Digital Implementations: Google Play|Digital Implementations: Steam|Game: Concordia|Misc: BGG Hall of Fame|Players: Games with expansions that add solo play|Region: Mediterranean Sea","Ancient|Economic|Nautical"
205637,"Arkham Horror: The Card Game",2016,120,29,7.89836,8.12749,45689,3.5565,"Action Points|Area Movement|Communication Limits|Cooperative Game|Deck Construction|Events|Hand Management|Map Deformation|Modular Board|Player Elimination|Push Your Luck|Role Playing|Scenario / Mission / Campaign Game|Solo / Solitaire Game|Stat Check Resolution|Variable Player Powers","Fantasy Flight Games|Arclight Games|Asmodee|Asterion Press|Edge Entertainment|Galakta|Galápagos Jogos|Heidelberger Spieleverlag|Hobby World|Korea Boardgames|Ігромаг","Nate French|MJ Newman","Collectible: Living Card Game (Fantasy Flight Games)|Game: Arkham Horror – The Card Game|Mechanism: Campaign Games|Players: Games with Solitaire Rules|Series: Arkham Horror Files (Fantasy Flight Games)|Theme: Cthulhu Mythos|Versions & Editions: Card Versions of Non-Card Games","Adventure|Card Game|Collectible Components|Exploration|Horror|Novel-based"
